AdfgStreamCode,StreamName,SurveyDate,Comments,BeginLatitude,BeginLongitude,BeginComments,EndLatitude,EndLongitude,EndComments,ExtentLatitude,ExtentLongitude,ExtentComments,DistanceMeters,SpeciesCode,CommonName,AliveCount,DeadCount,PreviouslySampledCount,TotalCount,NumberofSpecimens,NumberStrays,PercentStrays,numReadOK,numMarked,numUnMarked,SurveySamplers
111-33-10100,Prospect Creek,8/22/14,"Dropped off at the beach at 08:45.  Live/dead count was conducted on the way up the creek, beginning low in the intertidal zone and ending a 20 minute hike above the beaver dam.  No chums seen above the beaver damn although several pinks were observed.  The forest detour was omitted on the way up the creek to verify that no chums have been missed in that stretch.  Chum sampling was cunducted on the way down the creek.  Several green/prespawn chum were seen throughout the creek, the majority of which were observed in the lower half.  Lots of moldy pinks observed throughout.  The creek was clear and low, dropping throughout the day.  Weather was sunny to partly cloudy.  Probable wolf tracks were observed near totem tree sampling area in upper reach. Many bugs in the afternoon. Pickup around 17:45.",58.0511553,-133.8159802,,58.08326221,-133.864337,,,,,4575.362308,450,Chum Salmon,101,7,,108,15,0,0,15,0,15,"Jarrod Yelton, Ashley Bolwerk, Ben Campen, Dylan Fournier"
111-33-10100,Prospect Creek,8/23/14,"Dropped off on the beach at 08:45.  Live/dead count was conducted ont he way up the creek, to the first long riffle section.  Chum were sampled on the way down the creek.  Many non-moldy chum were observed in the lower section of the creek.  Creek was low and clear.  Weather was mostly cloudy.  Dolly varden were observed in spawning coloration.  Picked up at 15:00.",58.05622588,-133.8247214,,58.06313463,-133.8295907,,,,,821.4256959,450,Chum Salmon,94,1,,95,27,2,7.41,27,2,25,"Jarrod Yelton, Ashley Bolwerk, Ben Campen, Dylan Fournier"
111-33-10100,Prospect Creek,8/26/14,"Got dropped off at beach at 0845.  Counted fish on the way up.  Hiked upstream to the 2 large totem snags. Counted most of the observed chums in the lower stretch of the stream.  Many were still healthy and without mold.  Rain throughout the day, heavy at times.  Water visibility moderate at beginning of survey but turned poor later in the day. Sampled fish on the hike downstream.  Sow with 3 cubs observed in meadow on hike in.  Picked up at 1430. ",58.05629231,-133.8248303,,58.072573,-133.8441155,,,,,2141.016903,450,Chum Salmon,92,9,,101,11,0,0,11,0,11,"Jarrod Yelton, Ashley Bolwerk, Ben Campen, Dylan Fournier"
111-33-10100,Prospect Creek,8/29/14,"Dropped off at 1120.  Counted chum on hike upstream to the totem pole snags.  Many fresh chum seen this visit.  2 chum caught still had sea lice suggesting recent arrivals. Sow with 3 cubs seen on way up and on the way down.  Overcast, intermittant rain.  Water level low, visibility good.  Prespawn chum caught in both upper portion and lower portions of creek.  PIcked up at 1700. ",58.05585964,-133.8240672,,58.07261508,-133.8438972,,,,,2202.903773,450,Chum Salmon,90,5,,95,13,0,0,13,0,13,"Jarrod Yelton, Ashley Bolwerk, Ben Campen, Dylan Fournier"
111-33-10100,Prospect Creek,8/31/14,"Dropped off on tide flats at 0845.  Due to tides we fished in the lowest section with chums both on the way in and on the way out (Processing area #1 and #4 are in the same location).  After fishing in the lowest stretch we hiked upstream counting on the way.  Hiked up the the 2 large totem snags, before turning around and sampling on the way down.  Highest density of chum in the lowest stretches. Water level normal, visibility good - decreasing througout the day.  Rain throughout.  Many prespawn chum still observed throughout the creek.  Picked up at 1500.",58.05633911,-133.82487,,58.07284901,-133.8442086,,,,,2164.343222,450,Chum Salmon,119,4,,123,16,0,0,15,0,15,"Jarrod Yelton, Ashley Bolwerk, Ben Campen, Dylan Fournier"
111-33-10100,Prospect Creek,8/1/15,"SURVEY QUALITY: GOOD Started survey at low tide at 7:30 am sampling up stream. Water clarity clear through-out stream sample with high water flow up stream.  We surveyed up just before the bushwhack trail.  Surveyed end location around 9:30 am, but continued sampling downstream until 11:30 am.  Lots of pink salmon seen through-out creek.  Chum salmon that were able to be sampled looked non-ripe, but were found to be spawned out.  One female observed with one bad scain of eggs (A12).  Chums not seen in first major braid of stream where they have normally been sampled in previous years.  Most of live chum caught in first major hole in stream.  Four bears seen just after tidal flat.",58.04616866,-133.8087767,,58.06522023,-133.8328474,,,,,2553.881887,450,Chum Salmon,30,5,,35,15,9,60,15,9,6,"Alaire Hughey, Jarrod Yelton, Katie Shink, Brian LeBlanc"
111-33-10100,Prospect Creek,8/9/15,"SURVEY QUALITY: FAIR Began survey at high tide around 8:30 am. Water levels were much lower than previous visit, so we were able to survey upper portions of creek. End location taken at 'pride rock' at around 1:00 pm. No chum salmon had been seen for half mile before deciding to collect end location. Water had high visibility, but large numbers of pink salmon along with large rocks and rapids made chum viewing difficult. Clear blue skies and sunshine with a slight breeze all day. Daytime high in the mid 60's. Sow and three cubs seen at large gravel bar before first rapids section. ",58.05127708,-133.8176188,,58.07542671,-133.8537813,,,,,3433.855603,450,Chum Salmon,141,61,,202,75,40,53.33,75,40,35,"Alaire Hughey, Jarrod Yelton, Katie Shink, Brian LeBlanc"
111-33-10100,Prospect Creek,8/20/15,"SURVEY QUALITY: POOR Survey began at 8:30 am. Surveyed to the first rapid crossing. Unable to cros due to high water and poor clarity. Rained throughout survey, which ended at 10:30 am. ",58.0511182,-133.8150222,,58.06333884,-133.8296186,,,,,1610.980604,450,Chum Salmon,11,22,,33,21,7,36.84,19,7,12,"Alaire Hughey, Jarrod Yelton, Katie Shink, Brian LeBlanc"
111-33-10100,Prospect Creek,7/22/17,"SURVEY QUALITY: GOOD Kit did live counts, Mary did dead counts. Sampled as we walked upstream and stopped at pride rock aka second beaver dam since no fish had been seen in a while.  high tide:13:30low tide: 6:59 weather was overcast and rainy. saw 1 brown bear. didn't find any post spawned carcasses but found one chum head. practiced snagging in afternoon, didnt keep or kill any.",58.04712857,-133.8097924,,58.06883365,-133.8383279,,58.07454644,-133.8507441,,2946.574736,450,Chum Salmon,466,1,,467,1,1,100,1,1,0,"Anna Wietelmann, Kaitlin Cunningham, Mary Schvetz, Ben Adams"
111-33-10100,Prospect Creek,7/24/17,"SURVEY QUALITY: GOOD Dead counter-maryLive counter - AnnaOther ppl: Kit, dale, brianstarted at 902- low tide. ended survey at 2nd beaver dam at 1150. one carcasse found but only consisting of lower jaw. saw one brown bear in afternoon in meadow. Stream flow seemed lower than first trip.",58.04620317,-133.8086013,,58.0752831,-133.8540968,,,,,4207.550252,450,Chum Salmon,787,1,,788,0,,,,,,"Anna Wietelmann, Kaitlin Cunningham, Mary Schvetz"
111-33-10100,Prospect Creek,7/27/17,"SURVEY QUALITY: GOOD 1229 start time, 1615 end time. Anna did live count, Mary did dead count. high flows for lower half of creek. Saw injured bear while at procesing area 2. Most of our processed fish were preyed upon and missing the top half of their heads (so no brains/otaliths)",58.04743584,-133.8113704,,58.0746396,-133.8521506,,,,,3869.846656,450,Chum Salmon,1078,8,,1086,9,2,66.67,3,2,1,"Anna Wietelmann, Kaitlin Cunningham, Mary Schvetz"
111-33-10100,Prospect Creek,7/28/17,"SURVEY QUALITY: GOOD start time 1040, end time 1500. Started at low tide in tidal zone. Went above second beaver dam for 15 min. Higher than usual flow on the way up, due to last night's heavy rain. No bears today. ",58.04919468,-133.8114053,,58.07747827,-133.8560962,,,,,4108.883693,450,Chum Salmon,1005,6,,1011,6,1,16.67,6,1,5,"Anna Wietelmann, Kaitlin Cunningham, Mary Schvetz"
111-33-10100,Prospect Creek,7/31/17,"SURVEY QUALITY: GOOD high tide 812 - 11.3 ft. Llive counter: anna. Dead counter: mary.Dropped off at 830.Hhiked up to second beaver dam, surveyed and counted downstream. Scared off Harry once, 3 hrs later he showed up again resulting in throwing rocks and him growling, Eventually he did go back into the trees.",58.07505725,-133.8537698,,58.05085508,-133.8131881,,,,,3606.202936,450,Chum Salmon,1228,3,,1231,20,6,30,20,6,14,"Anna Wietelmann, Kaitlin Cunningham, Mary Schvetz"
111-33-10100,Prospect Creek,8/1/17,"SURVEY QUALITY: GOOD start mid tidal flat at 0930, survey and count upstream. end at first beaver dam at 1630. anna did live count and mary did dead count. low water flow, snagged most of our samples. Saw two bears both on tidal flat (maybe one twice) at beginning and end of day, no negative interactions.",58.05489562,-133.8225118,,58.07108289,-133.8427125,,,,,2161.57237,450,Chum Salmon,1049,18,,1067,36,9,25.71,35,9,26,"Anna Wietelmann, Kaitlin Cunningham, Mary Schvetz"
111-33-10100,Prospect Creek,8/4/17,"Start time 1045, survey end time 1800. live counts: Anna. Dead counts: Mary. Saw 5 bears today. Ended at first beaver dam. Water level was below average by at least 2.5 inches.",58.05444373,-133.8209408,,58.0706763,-133.8418678,,,,,2189.689565,450,Chum Salmon,1189,66,,1255,70,16,23.88,67,16,51,"Anna Wietelmann, Kaitlin Cunningham, Mary Schvetz"
111-33-10100,Prospect Creek,8/5/17,"SURVEY QUALITY: GOOD start 730 end 1320, surveyed up from tide flat to pride rock, Pushed bear up  1/4 mile before pride rock, black bear w/ cubs on way down past snagging spot. Low flows, lots of chum almost dead. Anna did live count, Mary did dead count.",58.0485239,-133.8127962,,58.07502474,-133.8534145,,,,,3802.800201,450,Chum Salmon,1300,83,,1383,32,10,31.25,32,10,22,"Anna Wietelmann, Kaitlin Cunningham, Mary Schvetz"
111-33-10100,Prospect Creek,8/8/17,"SURVEY QUALITY: GOOD start at 845 at tide flat, surveyed up and ended at 1820 at shady grove. Anna did live count, Mary did dead count. Four brown bears, Fired 2 separate shots at feet of 2 stubborn bears (one shot at each) below snagging bar. Low flows, lots of dead fish but still snagged/gaffed some.",58.04750503,-133.8107538,,58.06619598,-133.8330051,,,,,2461.619406,450,Chum Salmon,824,149,,973,140,50,35.71,140,50,90,"Anna Wietelmann, Kaitlin Cunningham, Mary Schvetz"
111-33-10100,Prospect Creek,8/9/17,"SURVEY QUALITY: GOOD start 845 at tide flat stop at 1730 at harrys slough Anna did live count  Mary did dead count. Saw 2 bears chased off, lots of dead fish but gaffed/snagged a lot too. Not many ready fish at Harrys slough. Low flows. ",58.04712894,-133.8111857,,58.06681097,-133.838123,,,,,2708.278048,450,Chum Salmon,679,194,,873,130,55,42.31,130,55,75,"Anna Wietelmann, Kaitlin Cunningham, Mary Schvetz"
111-33-10100,Prospect Creek,8/12/17,"SURVEY QUALITY: GOOD start 830 on tide flat.end at 1800. Saw 4 bears today, no issues. Many dead fish, Anna counted live fish. practically no gaffing. ",58.05116406,-133.8152724,,58.06027485,-133.8280787,,,,,1265.461265,450,Chum Salmon,249,363,,612,240,102,42.86,238,102,136,"Anna Wietelmann, Kaitlin Cunningham, Mary Schvetz"
111-33-10100,Prospect Creek,8/13/17,"SURVEY QUALITY: GOOD Start at 842 on tide flat end 1545 at penultimate bar. Anna did live count Mary did dead count.  Saw Harry and sibling (?) twice, Harry again on way out. Ran out of scale cards picking some up in Juneau tonight.  No snagging, Almost all dead fish.",58.05113552,-133.8162372,,58.06174502,-133.8294806,,,,,1416.929762,450,Chum Salmon,343,534,,877,157,69,44.81,154,69,85,"Anna Wietelmann, Kaitlin Cunningham, Mary Schvetz"
111-33-10100,Prospect Creek,8/16/17,"SURVEY QUALITY: POOR start at 1100 on tide flat stop at 1745 at snagging bar, so wet! Flows very high so poor visibility.At least two bears on tide flat  fishing, yelled at one when he got too close.",58.05195481,-133.8179465,,58.05999837,-133.8278805,,,,,1070.791926,450,Chum Salmon,70,238,,308,132,53,40.46,131,53,78,"Anna Wietelmann, Kaitlin Cunningham, Mary Schvetz"
111-33-10100,Prospect Creek,8/17/17,"SURVEY QUALITY: POOR start 850 hafway up tide flat end at 1030 at spruce trees couldn't go up further.  Mary did dead count.really high flows poor viz, saw a couple bears far away. ",58.05515158,-133.8226521,,58.06004785,-133.8281006,,,,,633.1380319,450,Chum Salmon,,12,,12,5,1,20,5,1,4,"Anna Wietelmann, Kaitlin Cunningham, Mary Schvetz"
111-33-10100,Prospect Creek,8/20/17,"SURVEY QUALITY: GOOD Start at 800 on tide flat. Stop at 1614 above penultimate bar, due to high water flow. Finished processing downstream batch at 1810, saved as 'other' location. High flows today, there was still clear visibility. Two bears at a distance.",58.04723477,-133.811357,,58.06369506,-133.8294688,,58.05326522,-133.8202091,,2122.400325,450,Chum Salmon,93,203,,296,182,74,40.66,182,74,108,"Anna Wietelmann, Kaitlin Cunningham, Mary Schvetz"
111-33-10100,Prospect Creek,8/21/17,SURVEY QUALITY: FAIR start at 815 on flat stop 1245 at penultimate bar; high water so we weren't able to go any further upstream. Tissue/otoliths for cell 31 tray 21715 were put in cell 30 by accident: cell 30 and 31 have uncertain pairing,58.04664601,-133.8092801,,58.06184749,-133.8296036,,,,,2075.230875,450,Chum Salmon,96,358,,454,60,30,50.85,59,30,29,"Anna Wietelmann, Kaitlin Cunningham, Mary Schvetz"
111-33-10100,Prospect Creek,8/23/17,"SURVEY QUALITY: GOOD start at 830 on tide flat after eagle vs bear showdown, same young sow at survivor bag rock, air horned her a couple corners up, yelled at Harry too. stopped at 1320 at first deep crossing upstream of otter rocks, water too fast! Saw mostly dead and alive pinks.  Anna did live count Mary did dead count. Cells 13 and 14 of tray 0000021718 are uncertain pairings.",58.04711213,-133.8097646,,58.06471749,-133.832125,,58.05987923,-133.8280752,,2363.859095,450,Chum Salmon,88,130,,218,55,14,26.42,53,14,39,"Anna Wietelmann, Kaitlin Cunningham, Mary Schvetz"
111-33-10100,Prospect Creek,8/24/17,"SURVEY QUALITY: GOOD Start at 830 on tide flat, Saw same sow as yesterday on tidal flat. Harry and sister(bears) at snagging bar, Dark sow close at first aid bar. No issues with any bears, they all just wandered off uoon seeing/hearing us. Surveyed up to first beaver dam, processed about 250 yds downstream, Finished at 1700.",58.04740247,-133.8117061,,58.07107024,-133.8428245,,,,,3213.067623,450,Chum Salmon,111,224,,335,140,53,38.69,137,53,84,"Anna Wietelmann, Kaitlin Cunningham, Mary Schvetz"
111-33-10100,Prospect Creek,8/26/17,"SURVEY QUALITY: POOR start at 830 just upstream of survivor bag rock. End at crossing upstream of snagging bar at 1000 due to high flows. No live count because of high flows and murky water. Surveyed lower tide flat on way out, saved as extent location.",58.05100102,-133.8142807,,58.06077697,-133.8280059,,58.04807465,-133.8116058,,1357.280002,450,Chum Salmon,,48,,48,18,4,22.22,18,4,14,"Anna Wietelmann, Kaitlin Cunningham, Mary Schvetz"
111-33-10100,Prospect Creek,7/21/18,"Clear skies, dry river. Started at second beaver dam and worked down towards tidal flat. ",58.07524522,-133.8537315,,58.05001139,-133.8117405,,,,,3747.401057,450,Chum Salmon,305,0,,305,0,,,,,,"Cory Dick, Devon Calvin, Ryan Lawton, Brian LeBlanc"
111-33-10100,Prospect Creek,7/23/18,SURVEY QUALITY: GOOD Started at topsunny daylow watermet Sally and Harryextent up to mink log,58.07531101,-133.8536738,,58.05113451,-133.8158838,,58.07746997,-133.8562272,,3496.694569,450,Chum Salmon,313,1,,314,1,0,0,1,0,1,"Cory Dick, Devon Calvin, Ryan Lawton"
111-33-10100,Prospect Creek,7/24/18,SURVEY QUALITY: GOOD sunny daystarted at second beaver damno sign of Harry,58.07516241,-133.8534629,,58.05348893,-133.8205538,,,,,3098.486568,450,Chum Salmon,372,0,,372,0,,,,,,"Cory Dick, Devon Calvin, Ryan Lawton"
111-33-10100,Prospect Creek,7/27/18,sunny daystarted at bottomChum beginning to pair and build redsSURVEY QUALITY: GOOD,58.04724657,-133.809489,,58.07512375,-133.8535486,,,,,4050.35602,450,Chum Salmon,446,0,,446,0,,,,,,"Cory Dick, Devon Calvin, Ryan Lawton"
111-33-10100,Prospect Creek,7/28/18,"SURVEY QUALITY: GOOD sunny day, started at bottomHad to pull out spray on Harry the bear, but did not use...yet",58.04708527,-133.8097161,,58.07511983,-133.8535578,,,,,4055.586886,450,Chum Salmon,435,2,,437,2,0,0,2,0,2,"Cory Dick, Devon Calvin, Ryan Lawton"
111-33-10100,Prospect Creek,7/31/18,SURVEY QUALITY: GOOD sunny daystarted at bottomvery low water,58.04705376,-133.8096776,,58.07365863,-133.8485275,,,,,3747.064973,450,Chum Salmon,466,1,,467,2,0,0,1,0,1,"Cory Dick, Devon Calvin, Ryan Lawton"
111-33-10100,Prospect Creek,8/1/18,"SURVEY QUALITY: GOOD sunny day, started at bottom",58.04778165,-133.812014,,58.07358996,-133.8459665,,,,,3504.282949,450,Chum Salmon,496,5,,501,8,1,14.29,7,1,6,"Cory Dick, Devon Calvin, Ryan Lawton"
111-33-10100,Prospect Creek,8/5/18,SURVEY QUALITY: GOOD sunny day started at top,58.07363316,-133.8485459,,58.04797582,-133.811568,,,,,3596.026485,450,Chum Salmon,468,12,,480,11,0,0,8,0,8,"Cory Dick, Devon Calvin, Ryan Lawton"
111-33-10100,Prospect Creek,8/6/18,Cloudy day very low waterstarted at top where water ended,58.07374821,-133.8487155,,58.05122347,-133.8162414,,,,,3157.31322,450,Chum Salmon,569,15,,584,15,4,28.57,14,4,10,"Cory Dick, Devon Calvin, Ryan Lawton"
111-33-10100,Prospect Creek,8/9/18,"Rainy dayvery high watertoo high to cross, ended early",58.04728639,-133.8108819,,58.05867637,-133.8267754,,,,,1577.978058,450,Chum Salmon,0,0,,0,0,,,,,,"Cory Dick, Devon Calvin, Ryan Lawton"
111-33-10100,Prospect Creek,8/10/18,"SURVEY QUALITY: FAIR Rainy dayVery high water Started at bottomMurky water, hard to get live count",58.04686321,-133.8115522,,58.07491967,-133.8534068,,,,,3983.68047,450,Chum Salmon,188,40,,228,37,3,8.82,34,3,31,"Cory Dick, Devon Calvin, Ryan Lawton"
111-33-10100,Prospect Creek,8/13/18,SURVEY QUALITY: GOOD Cloudy day with some rain started at bottomwater not very clearhard to see chumApproximately 1000 pinks in stream,58.0465339,-133.8077265,,58.0737269,-133.848702,,,,,3876.132331,450,Chum Salmon,130,7,,137,8,5,62.5,8,5,3,"Cory Dick, Devon Calvin, Ryan Lawton"
111-33-10100,Prospect Creek,8/14/18,Rainy day with high water levels started at bottom,58.04572271,-133.809418,,58.06363979,-133.82983,,,,,2331.264735,450,Chum Salmon,28,3,,31,3,0,0,3,0,3,"Cory Dick, Devon Calvin, Ryan Lawton"
111-33-10100,Prospect Creek,8/18/18,SURVEY QUALITY: GOODpartly cloudystarted at top,58.07499718,-133.8534791,,58.04802277,-133.8117197,,,,,3886.269613,450,Chum Salmon,103,3,,106,3,0,0,3,0,3,"Cory Dick, Devon Calvin, Ryan Lawton"
111-33-10100,Prospect Creek,8/19/18,sunny day started at 2nd beaver damSURVEY QUALITY: GOOD,58.07480043,-133.8534084,,58.04788907,-133.8118585,,,,,3873.006509,450,Chum Salmon,55,0,,55,1,1,100,1,1,0,"Cory Dick, Devon Calvin, Ryan Lawton"
111-33-10100,Prospect Creek,8/22/18,SURVEY QUALITY: GOOD Cloudy day started at second beaver damlate wave of fresh chum present,58.07494363,-133.8535331,,58.05114737,-133.8133515,,,,,3556.739503,450,Chum Salmon,110,4,,114,4,2,50,4,2,2,"Cory Dick, Devon Calvin, Ryan Lawton"
111-33-10100,Prospect Creek,8/23/18,"SURVEY QUALITY: GOOD Cloudy day, fairly high waterFirst day of sampling Chum jawsTissue from jaws consists of any soft tissue/cartilage on jaw",58.07474584,-133.8534418,,58.05286411,-133.8200992,,,,,3132.620802,450,Chum Salmon,108,18,,126,18,0,0,1,0,1,"Cory Dick, Devon Calvin, Ryan Lawton"
111-33-10100,Prospect Creek,8/26/18,SURVEY QUALITY: EXCELLENT sunny daystarted at bottom ,58.04705601,-133.8097106,,58.07511074,-133.8535523,,,,,4057.32277,450,Chum Salmon,69,3,,72,3,0,0,1,0,1,"Cory Dick, Devon Calvin, Brian LeBlanc, Jesse  Klejka"
111-33-10100,Prospect Creek,8/27/18,SURVEY QUALITY: FAIRRainy day.High water.Ended above first beaver dam.Last day on Prospect.,58.04785845,-133.8123215,,58.07183398,-133.8428845,,,,,3222.763799,450,Chum Salmon,58,2,,60,2,0,0,1,0,1,"Cory Dick, Devon Calvin, Jesse  Klejka"
111-33-10100,Prospect Creek,7/21/19,SURVEY QUALITY: EXCELLENT ,58.05006845,-133.8118391,"start at intertidal, went upstream",58.0751319,-133.8533887,second beaver dam ,,,,3715.939051,450,Chum Salmon,37,0,,37,0,,,,,,"Patrick Landback, Caitlin  Jensen, Michelle Trifari"
111-33-10100,Prospect Creek,7/23/19,"SURVEY QUALITY: EXCELLENT low water, high clarity",58.05001574,-133.8120322,"start at intertidal,work upstream",58.07499523,-133.8535874,end at second beaver dam,,,,3709.1416,450,Chum Salmon,63,0,,63,0,,,,,,"Patrick Landback, Caitlin  Jensen, Michelle Trifari"
111-33-10100,Prospect Creek,7/24/19,SURVEY QUALITY: EXCELLENT cloudy with slight drizzle. low water,58.07519837,-133.8534341,start at second beaver dam.work downstream,58.04807149,-133.8117592,end at intertidal,,,,3896.254883,450,Chum Salmon,87,0,,87,0,,,,,,"Patrick Landback, Caitlin  Jensen, Michelle Trifari"
111-33-10100,Prospect Creek,7/25/19,SURVEY QUALITY: EXCELLENT low water,58.07519646,-133.8536165,"start at second beaver dam,work downstream",58.0480135,-133.8116359,end at intertidal,,,,3912.503169,450,Chum Salmon,110,1,,111,1,1,100,1,1,0,"Patrick Landback, Caitlin  Jensen, Michelle Trifari"
111-33-10100,Prospect Creek,7/27/19,SURVEY QUALITY: FAIR lower water visibility,58.07481253,-133.8537288,start at second  beaver dam. work down stream,58.04803729,-133.8117761,end are intertidal,,,,3876.429442,450,Chum Salmon,196,1,,197,1,1,100,1,1,0,"Patrick Landback, Caitlin  Jensen, Michelle Trifari"
111-33-10100,Prospect Creek,7/28/19,"SURVEY QUALITY: POOR High water led to high turbidity and low water clarity. We reached an impassable set of rapids and started the survey approximately halfway up the stream.Surveyed downstream. Reached intertidal early, at 2:15 pm when low tide was 4:53 pm.",58.06520779,-133.8324085,start halfway through. river rough,58.0514451,-133.8183129,end at intertidal,,,,1744.18338,450,Chum Salmon,73,0,,73,1,0,0,0,0,0,"Patrick Landback, Caitlin  Jensen, Michelle Trifari"
111-33-10100,Prospect Creek,7/29/19,"SURVEY QUALITY: EXCELLENT Started at second beaver dam, working downstream. water clarity was good.Ended in intertidal at 5:30pn, low tide was at 5:52pm, 4.1ft",58.0750678,-133.8535192,second beaver dam,58.04880867,-133.8114141,intertidal,,,,3838.177569,450,Chum Salmon,417,16,,433,17,2,28.57,7,2,5,"Patrick Landback, Caitlin  Jensen, Michelle Trifari"
111-33-10100,Prospect Creek,7/30/19,intertidal upstream,58.0476519,-133.8124684,,58.07505899,-133.8534017,,,,,3893.196677,450,Chum Salmon,280,19,,299,4,1,50,2,1,1,"Patrick Landback, Caitlin  Jensen, Michelle Trifari"
111-33-10100,Prospect Creek,7/31/19,"Surveyed upsteam. Low water, clarity 8ft plus. Survey quality excellect. Michele on live counts. Patrick counted pinks.",58.04767511,-133.8121929,,58.07517336,-133.8536543,,,,,3920.543852,450,Chum Salmon,419,19,,438,6,0,0,2,0,2,"Patrick Landback, Caitlin  Jensen, Michelle Trifari"
111-33-10100,Prospect Creek,8/1/19,Surveyed upstream. -4 tide. Survey quality execellent. Michelle on live counts. Patrick on pink counts. Missing PA3 photo,58.04651214,-133.8079354,negative intertidal ,58.07506498,-133.8536168,,,,,4169.617087,450,Chum Salmon,555,6,,561,6,0,0,4,0,4,"Patrick Landback, Caitlin  Jensen, Michelle Trifari"
111-33-10100,Prospect Creek,8/2/19,"SURVEY QUALITY: EXCELLENT low intertidal surveying upstream. Started survey at 0830Sunny, good water clarity M.Trifari performed live countsLow tide: 0848 -4.3 ft",58.04653073,-133.8078496,,58.07502548,-133.8537066,,,,,4171.400536,450,Chum Salmon,426,3,,429,5,0,0,3,0,3,"Patrick Landback, Caitlin  Jensen, Michelle Trifari"
111-33-10100,Prospect Creek,8/3/19,"SURVEY QUALITY: EXCELLENT surveying upstream low intertidal. Low tide was at 0932.Sunny weather, good water visibility, low water depthM. Trifari performed live counts",58.04656865,-133.8077994,,58.07491946,-133.8535086,,,,,4153.547739,450,Chum Salmon,515,6,,521,10,3,33.33,9,3,6,"Patrick Landback, Caitlin  Jensen, Michelle Trifari"
111-33-10100,Prospect Creek,8/4/19,"SURVEY QUALITY: EXCELLENT surveying upstream, started 8:45, low tide at 10:15 -3.1ft. Sunny, water clarity excellent, creek low.Saw one bear at the intersection of the meadow and the trees.",58.04777764,-133.8121545,,58.07510899,-133.8533575,,,,,3896.497305,450,Chum Salmon,543,8,,551,3,1,100,1,1,0,"Patrick Landback, Caitlin  Jensen, Michelle Trifari"
111-33-10100,Prospect Creek,8/6/19,"SURVEY QUALITY: EXCELLENT Surveyed upstream, starting at 9am. Low tide ~11:40am.Caitlin on live chum counts, Patrick on pink counts.Sunny, dry weather continues. Creek has dropped to a trickle at a bend in the upper portion of our survey, see picture.Saw three river otters by a beaver pond.",58.04737354,-133.8119838,,58.07511946,-133.8534777,,,,,3943.327266,450,Chum Salmon,529,8,,537,12,6,50,12,6,6,"Patrick Landback, Caitlin  Jensen, Michelle Trifari"
111-33-10100,Prospect Creek,8/7/19,"Survey upsteam, low tide at 1pm, 2.1ft. Caitlin on live counts.Clear and sunny, survey quality excellent.Half a mile from the normal end of the survey, the creek has run dry.No chum have been observed above this point this season, so survey was ended there today.",58.0509764,-133.8144043,,58.07370634,-133.8472725,,,,,3189.607335,450,Chum Salmon,583,28,,611,25,6,28.57,21,6,15,"Patrick Landback, Caitlin  Jensen, Michelle Trifari"
111-33-10100,Prospect Creek,8/8/19,"SURVEY QUALITY: EXCELLENT surveying downstreamLow tide at 1:49 pmdry creek at start, depth of creek decreasingCaitlin on live countsMichelle on dead counts",58.07365644,-133.8479593,,58.05096494,-133.8145399,,,,,3206.126255,450,Chum Salmon,588,36,,624,24,11,45.83,24,11,13,"Patrick Landback, Caitlin  Jensen, Michelle Trifari"
