AdfgStreamCode,StreamName,SurveyDate,Comments,BeginLatitude,BeginLongitude,BeginComments,EndLatitude,EndLongitude,EndComments,ExtentLatitude,ExtentLongitude,ExtentComments,DistanceMeters,SpeciesCode,CommonName,AliveCount,DeadCount,PreviouslySampledCount,TotalCount,NumberofSpecimens,NumberStrays,PercentStrays,numReadOK,numMarked,numUnMarked,SurveySamplers
111-41-10050,Admiralty Creek,7/29/17,"SURVEY QUALITY: FAIR due to high flows forcing us to bushwhack more than normalstart 1000 end 1730Mary did live count, Anna did dead countStarted at knee tree worked down, didn't get a location from processing area 1, will return tomorrow to get location",58.15384107,-134.5234616,,58.17378274,-134.5626947,,,,,3204.13715,450,Chum Salmon,354,11,,365,15,0,0,15,0,15,"Anna Wietelmann, Kaitlin Cunningham, Mary Schvetz"
111-41-10050,Admiralty Creek,7/30/17,"SURVEY QUALITY: GOOD to fair, took some braids with not many fish. Mary did live count, Anna did dead countstart 0935 from knee tree surveyed down stop at 1623. flows normal, saw 1 bear on trail",58.15370415,-134.5232076,,58.17374345,-134.5626671,,,,,3221.28283,450,Chum Salmon,286,11,,297,17,1,6.25,16,1,15,"Anna Wietelmann, Kaitlin Cunningham, Mary Schvetz"
111-41-10050,Admiralty Creek,8/2/17,"SURVEY QUALITY: GOOD Start 1155, End 1800 surveyed down from knee tree to PA5, 45 minutes up trail. Live count: Mary, dead count: Anna. Two bears,1 from trail, 1 on river. Snagged a lot but started finding dead fish too. ",58.15381931,-134.5238651,,58.16253312,-134.5386872,,,,,1305.145694,450,Chum Salmon,274,20,,294,39,1,2.56,39,1,38,"Anna Wietelmann, Kaitlin Cunningham, Mary Schvetz"
111-41-10050,Admiralty Creek,8/3/17,"SURVEY QUALITY: GOOD drop off time 740, survey start time 848. end time 1630  Started 45 minutes up trail where we stopped yesterday. Lower flows, fewer dead chum the farther downstream we got, ended at cabin. Not much snagging.",58.16261825,-134.5380187,,58.1759213,-134.5609373,,,,,2003.698177,450,Chum Salmon,234,55,,289,57,3,5.26,57,3,54,"Anna Wietelmann, Kaitlin Cunningham, Mary Schvetz"
111-41-10050,Admiralty Creek,8/6/17,"SURVEY QUALITY: FAIR start at 8:20.survey start at 10:00. Survey end time 1700. Made it half way down creek. Had one bear encounter, we spooked it coming around a log. It charged ron and then ran off. ",58.15379504,-134.5236017,,58.16282697,-134.538388,,,,,1330.3229,450,Chum Salmon,178,71,,249,73,2,2.9,69,2,67,"Anna Wietelmann, Kaitlin Cunningham, Chance Gray"
111-41-10050,Admiralty Creek,8/7/17,"SURVEY QUALITY: GOOD start time 900. start survey time 1000. anna dead counts. kit live counts. started halfway downstream at yesterdays stopping point. kit is doing tablet and scales, anna is cutting. ended at 1615. no bears today. lots of dead fish, no snagging",58.16274493,-134.5384318,,58.16446672,-134.5434412,,,,,351.7462591,450,Chum Salmon,202,81,,283,70,1,1.43,70,1,69,"Anna Wietelmann, Kaitlin Cunningham"
111-41-10050,Admiralty Creek,8/10/17,"SURVEY QUALITY: GOOD start 945 at platform 9 3/4, end at 1820 just below trunnel. Saw three bears today. Two on trail, one in stream. They ran off quickly. More dead fish, didnt really gaff or snag any. ",58.16316451,-134.5389257,,58.16551254,-134.5452662,,,,,455.7270694,450,Chum Salmon,156,206,,362,154,4,2.68,149,4,145,"Anna Wietelmann, Kaitlin Cunningham, Mary Schvetz"
111-41-10050,Admiralty Creek,8/11/17,"SURVEY QUALITY: GOOD Start 924 below trunnel where we stopped yesterday, Stopped at 1730 at the 'mother of all gravel bars', Mary did live count, Anna did dead count. Low flows, Lots of dead fish, Hardly gaffed any, Didn't bring rod.",58.16574915,-134.5453236,,58.17191281,-134.5508856,,,,,760.5629377,450,Chum Salmon,139,173,,312,124,3,2.46,122,3,119,"Anna Wietelmann, Kaitlin Cunningham, Mary Schvetz"
111-41-10050,Admiralty Creek,8/14/17,"SURVEY QUALITY: FAIR Started 9:30 at platform 9 3/4. End at 1800 at PA 6. Higher flows and silty water made count quality lower. Saw one bear today, ran off immediately. Less fish today. ",58.1634364,-134.5385387,,58.16996319,-134.5494873,,,,,971.4583139,450,Chum Salmon,107,243,,350,127,5,4.03,124,5,119,"Anna Wietelmann, Kaitlin Cunningham, Mary Schvetz"
111-41-10050,Admiralty Creek,8/15/17,SURVEY QUALITY: FAIR start at 850 below snaggle tree. Stop at 1220 at bar near cabin. Checked out tidal briefly on the way to skiffs and didn't see any carcasses. Appears to have less chum as downstream,58.17025501,-134.5496175,,58.17546891,-134.563636,,,,,1008.858309,450,Chum Salmon,42,77,,119,60,5,8.33,60,5,55,"Anna Wietelmann, Kaitlin Cunningham, Mary Schvetz"
111-41-10050,Admiralty Creek,8/18/17,"start at 610 at creek mouth survey up stop at 1130 upstream of platform 9 3/4. sporadic survey on trail accessible spots due to high flows, so no count",58.18060975,-134.5783019,,58.16262294,-134.5379271,,,,,3107.914843,450,Chum Salmon,,,,,13,0,0,13,0,13,"Anna Wietelmann, Kaitlin Cunningham, Mary Schvetz"
111-41-10050,Admiralty Creek,8/19/17,"SURVEY QUALITY: FAIR water still high/murky, not great visibility.  start at 1000 at knee tree surveyed down until wet eagle spot just above cabin at 1800, lots of dead pinks but not many chum. Mary did live count, Anna did dead count.",58.15400825,-134.5231492,,58.17529207,-134.5591931,,,,,3181.336696,450,Chum Salmon,42,80,,122,60,1,1.69,59,1,58,"Anna Wietelmann, Kaitlin Cunningham, Mary Schvetz"
111-41-10050,Admiralty Creek,8/22/17,"Start at 900 at cabin surveyed up, really high muddy water so surveyed from trail. Highest flows yet; rock by cabin was completely submerged. Stopped at 1100 at platform 9 3/4, no count. Spooked brown bear cub up a tree, mom possibly heard as well.",58.17615961,-134.5616324,,58.16317169,-134.5383476,,,,,1992.6336,450,Chum Salmon,,,,,1,0,0,1,0,1,"Anna Wietelmann, Kaitlin Cunningham, Mary Schvetz"
111-41-10050,Admiralty Creek,8/25/17,"SURVEY QUALITY: FAIR start 1010 at platform 9 3/4, water still high and slightly murky but passable, stopped at cabin at 1630. Mary did live count Anna did dead count",58.1628838,-134.5392522,,58.17604657,-134.5619236,,,,,1982.347878,450,Chum Salmon,12,69,,81,57,5,8.93,56,5,51,"Anna Wietelmann, Kaitlin Cunningham, Mary Schvetz"
111-41-10050,Admiralty Creek,7/22/18,SURVEY QUALITY: GOOD sunny day started at topLow water. Extent was the tidal flat. Saw about half of live fish in tidal flat.,58.15398877,-134.5243985,,58.17549329,-134.5620598,,58.17517804,-134.583147,,3263.590734,450,Chum Salmon,333,0,,333,0,,,,,,"Cory Dick, Devon Calvin, Ryan Lawton, Brian LeBlanc"
111-41-10050,Admiralty Creek,7/25/18,SURVEY QUALITY: GOOD sunny day started at topChum seem to have a hard time making it up stream due to low water conditionsOnly 5 live chum counted at top one and a half mile stretch of survey,58.15386075,-134.5235794,,58.17625034,-134.5621561,,,,,3372.638219,450,Chum Salmon,193,0,,193,0,,,,,,"Cory Dick, Devon Calvin, Ryan Lawton"
111-41-10050,Admiralty Creek,7/26/18,SURVEY QUALITY: GOOD Cloudy daystarted at topA couple large schools of Chum at lower stretch of stream near cabin ,58.15387526,-134.523356,,58.17594492,-134.5633796,,,,,3404.745838,450,Chum Salmon,251,0,,251,0,,,,,,"Cory Dick, Devon Calvin, Ryan Lawton"
111-41-10050,Admiralty Creek,7/29/18,SURVEY QUALITY: GOODpartly cloudystarted at top,58.15391249,-134.5233562,,58.17584822,-134.5636719,,,,,3405.947844,450,Chum Salmon,260,0,,260,0,,,,,,"Cory Dick, Devon Calvin, Ryan Lawton"
111-41-10050,Admiralty Creek,7/30/18,SURVEY QUALITY: GOOD sunny daysurveying only the tidal flatsnagging moldy chun in tide flatAll pre-spawn,58.17497677,-134.58332,,58.16845464,-134.5475117,,,,,2228.996352,450,Chum Salmon,255,0,,255,0,,,,,,"Cory Dick, Devon Calvin, Ryan Lawton"
111-41-10050,Admiralty Creek,8/2/18,"SURVEY QUALITY: GOOD overcast conditions, survey started from mouth, Chum starting to build reddsbig schools of green chum still at the mouth of the tidal flats, in the salt water",58.18236361,-134.5761123,,58.16312988,-134.5393301,,,,,3045.423052,450,Chum Salmon,320,,,320,0,,,,,,"Cory Dick, Devon Calvin, Ryan Lawton"
111-41-10050,Admiralty Creek,8/3/18,"SURVEY QUALITY: GOOD rain, start from topSurveyed from knee tree to cabinMost of fish came within a quarter mile of cabin",58.15402217,-134.5232403,,58.17608589,-134.5620924,,,,,3356.915432,450,Chum Salmon,145,,,145,0,,,,,,"Cory Dick, Devon Calvin, Ryan Lawton"
111-41-10050,Admiralty Creek,8/7/18,"SURVEY QUALITY: GOOD light rain, extremely low flow, many more Chum in upper reach",58.15377015,-134.5236689,,58.17454029,-134.5834235,,,,,4209.866603,450,Chum Salmon,679,1,,680,2,0,0,2,0,2,"Cory Dick, Devon Calvin, Ryan Lawton"
111-41-10050,Admiralty Creek,8/8/18,"SURVEY QUALITY: GOOD Cloudy day, low water, many Chum preyed upon",58.16317405,-134.5389014,,58.17493376,-134.5832112,,58.15817552,-134.5312088,one half mile us of long island,2918.259361,450,Chum Salmon,619,8,,627,10,1,11.11,9,1,8,"Cory Dick, Devon Calvin, Ryan Lawton"
111-41-10050,Admiralty Creek,8/11/18,"SURVEY QUALITY: FAIR sunny dayextent at tidal flatstarted at topstream very turbid, poor visibility",58.15385204,-134.5235207,,58.17576297,-134.5610338,,58.17486742,-134.5832681,,3291.09721,450,Chum Salmon,291,4,,295,2,1,50,2,1,1,"Cory Dick, Devon Calvin, Ryan Lawton"
111-41-10050,Admiralty Creek,8/12/18,"SURVEY QUALITY: FAIR light rain, minus 4 '  tide, water very turbid, Chum observed in upper reaches",58.15379549,-134.5235172,,58.17573911,-134.5610557,,58.1835125,-134.580729,,3294.801252,450,Chum Salmon,408,9,,417,8,2,25,8,2,6,"Cory Dick, Devon Calvin, Ryan Lawton"
111-41-10050,Admiralty Creek,8/15/18,"overcast, water still tannic,",58.15405057,-134.5235773,,58.17373491,-134.562493,,58.14913789,-134.5179663,,3170.806275,450,Chum Salmon,411,5,,416,8,1,12.5,8,1,7,"Chance Gray, Cory Dick, Devon Calvin, Ryan Lawton"
111-41-10050,Admiralty Creek,8/16/18,light rainstarted at topgrabbed extent updirty waterSurvey Quality: Good,58.15389999,-134.5236834,,58.17596249,-134.5628568,,58.15065837,-134.5214616,,3369.732286,450,Chum Salmon,511,3,,514,4,1,25,4,1,3,"Chance Gray, Cory Dick, Devon Calvin, Ryan Lawton"
111-41-10050,Admiralty Creek,8/20/18,SURVEY QUALITY: FAIRClear and sunny low flow lots of dead pinks,58.15387155,-134.5235844,,58.17460162,-134.5834548,,58.15280147,-134.5237495,,4213.11186,450,Chum Salmon,101,2,,103,4,0,0,4,0,4,"Cory Dick, Devon Calvin, Ryan Lawton"
111-41-10050,Admiralty Creek,8/21/18,SURVEY QUALITY: GOODstarted 1000m above usual spotsunny then rainy lots of bears in upper reachhigh predation,58.14816565,-134.5154086,,58.17583255,-134.5609074,,,,,4082.808112,450,Chum Salmon,48,1,,49,1,0,0,1,0,1,"Cory Dick, Devon Calvin, Ryan Lawton"
111-41-10050,Admiralty Creek,8/24/18,SURVEY QUALITY: GOOD rain,58.15384566,-134.5234336,,58.17546464,-134.5637439,,,,,3380.519781,450,Chum Salmon,21,21,,42,21,0,0,0,0,0,"Cory Dick, Devon Calvin, Ryan Lawton"
111-41-10050,Admiralty Creek,8/25/18,"SURVEY QUALITY: GOOD rain, pinks are mostly gone",58.15374936,-134.5234291,,58.17389024,-134.5624357,,,,,3210.007032,450,Chum Salmon,16,,,16,0,,,,,,"Cory Dick, Devon Calvin, Ryan Lawton"
111-41-10050,Admiralty Creek,8/28/18,SURVEY QUALITY: POOR Heavy rainHigh water. Very murky. Risky walking conditions,58.1677251,-134.5470655,,58.17460105,-134.583462,,,,,2274.746478,450,Chum Salmon,2,,,2,0,,,,,,"Cory Dick, Devon Calvin, Jesse  Klejka"
111-41-10050,Admiralty Creek,7/18/19,science center tent,57.04959809,-135.3236817,,57.04961285,-135.3237399,,,,,3.894283931,450,Chum Salmon,,,,,2,0,0,0,0,0,"Ryan Lawton, Molly Payne, Alexandra  Cabanelas, Chrissy Webb"
111-50-10690,Fish Creek,7/21/13,beg lat long erroneous,58.33350778,-134.6024008,,58.33031847,-134.5957525,,,,,527.1569436,450,Chum Salmon,507,35,,542,217,112,53.08,211,112,99,"Rick Busch, Jacob Van Baalen, ben adams, Laurinda Marcello, jon livermore, Dave Magnus, ashley bulwerk, Eric Knudsen, eric knudsen, Alix Blake"
111-50-10690,Fish Creek,7/24/13,,58.32963829,-134.5890142,,58.32894585,-134.5846076,,,,,269.4501661,450,Chum Salmon,377,72,,449,125,60,48.78,123,60,63,"Rick Busch, Jacob Van Baalen, ben adams, Laurinda Marcello, jon livermore, Dave Magnus, ashley bulwerk, Eric Knudsen, eric knudsen, Alix Blake"
111-50-10690,Fish Creek,8/1/13,,58.33053133,-134.5954043,,58.32862958,-134.5773882,,,,,1076.581519,450,Chum Salmon,,,,,192,143,74.48,192,143,49,"ben adams, jon livermore, ashley bulwerk, Alix Blake"
111-50-10690,Fish Creek,8/2/13,,58.32778651,-134.5730982,,58.33016226,-134.5916762,,,,,1120.177787,450,Chum Salmon,,,,,168,115,69.28,166,115,51,
111-50-10690,Fish Creek,8/12/13,,58.33048337,-134.5953775,,58.32882584,-134.5858434,,,,,588.3088686,450,Chum Salmon,211,415,,626,65,51,79.69,64,51,13,
111-50-10690,Fish Creek,7/7/14,Surveyed from green channel marker to large pool and upper end of previously survyed reach. No chum observed.,58.336833,-134.60805,,58.32956,-134.58305,,,,,1673.677932,450,Chum Salmon,0,0,,0,0,,,,,,Dale Brandenburger
111-50-10690,Fish Creek,7/21/14,"survey just to check live dead. Started just down from small, only wood pile on right bank below fish pond and ended downstream edge of road bridge. The dead are in various states",58.33239522,-134.6013237,,58.33064704,-134.5929805,,,,,526.1444122,450,Chum Salmon,296,11,,307,0,,,,,,Eric Knudsen
111-50-10690,Fish Creek,7/23/14,Started 1/4 mile upstream of mouth at 0950. Tide coming in fast. Ended about 300 meters below foot bridge. Stream flow relatively low. Few pinks near mouth. ,58.33300626,-134.602159,,58.3302108,-134.5967507,,,,,444.2302416,450,Chum Salmon,227,59,,286,48,33,75,44,33,11,"Kelly Lawrence, Alaire Hughey, Eric Knudsen"
111-50-10690,Fish Creek,7/24/14,2nd Day. Greatly reduced fish numbers at upstream beginning of reach. Water clarity excellent and stream low. Ped2 crew sampled in downstream direction from around the upper extent. Ped1 crew started from first split below the foot bridge and headed upstream. Tray 1400000582  has one cell with alternate DNA tissue that was not marked in the tablet. Ped1 crew skipped a few areas in order to move up stream more quickly. ,58.32777294,-134.5732774,,58.32850757,-134.5876624,,,,,846.7889676,450,Chum Salmon,772,77,,849,163,92,58.23,158,92,66,"ashley bolwerk, Kelly Lawrence, Alaire Hughey, Derrick Miller, Eric Knudsen, jarrod yelton, ben campen, dylan fournier"
111-50-10690,Fish Creek,7/25/14,Start time = 0735; Discharge up from previous days as a result of precip. event; Visability good; Began survey at low tide and sampled in an upstream direction.,58.33463801,-134.6048351,,58.33006816,-134.5901714,,,,,998.5336827,450,Chum Salmon,249,225,,474,125,69,55.2,125,69,56,"Kelly Lawrence, Alaire Hughey, Derrick Miller"
111-50-10690,Fish Creek,7/27/14,started after 800 from highway bridge with Ped 1 starting in tide flats next to marker 19A and working up. discharge increased and visibility declined since previous survey due to precip. ,58.33053252,-134.5925554,,58.32912703,-134.5815589,,,,,663.0092421,450,Chum Salmon,411,297,,708,190,85,46.2,184,85,99,"ashley bolwerk, Kelly Lawrence, Alaire Hughey, Derrick Miller, jarrod yelton, ben campen, dylan fournier"
111-50-10690,Fish Creek,7/30/14,"Ped 1 crew started below red house and ended at footbridge. Ped2 crew working US from foot bridge. Flow high and dark, unable to count or fish in deep pools and walked around some of the bigger rapids. ",58.33500025,-134.6055471,,58.3305509,-134.5950326,,,,,790.5830833,450,Chum Salmon,485,364,,849,266,128,49.42,258,128,131,"ashley bolwerk, Ben Adams, Kelly Lawrence, Alaire Hughey, Derrick Miller, jarrod yelton, ben campen, dylan fournier"
111-50-10690,Fish Creek,7/31/14,"began at last processing aeea from yesterday.  with Lorraine and Mark with ADFG. stream flow significantly lower than yesterday. Hiked to upper extent, as recorded in survey is about 1/4 mile past last processing area and 400 meters past last observed fish ",58.32890314,-134.5781497,,58.3268013,-134.5685248,,58.32675386,-134.5684785,,610.6000504,450,Chum Salmon,173,37,,210,75,15,21.43,70,15,55,"Kelly Lawrence, Alaire Hughey"
111-50-10690,Fish Creek,8/2/14,"ped1 and ped2 crews today, both started at footbridge and ped1 went down ped2 went up.stream flow decreased and visibility increased after 3 days without rain. lots of spawned out live and dead fish present",58.33054795,-134.5942138,,58.32897076,-134.5854361,,,,,543.4445778,450,Chum Salmon,,,,,226,137,63.72,215,137,78,"ashley bolwerk, Kelly Lawrence, Alaire Hughey, Derrick Miller, jarrod yelton, ben campen, dylan fournier"
111-50-10690,Fish Creek,8/3/14,water level low and clear. Sampled upper end of stream and saw mostly dead and post spawned fish. ,58.32901495,-134.584805,,58.32880179,-134.5775802,,,,,423.9649131,450,Chum Salmon,252,211,,463,192,101,53.44,189,101,88,"Kelly Lawrence, Derrick Miller, jarrod yelton"
111-50-10690,Fish Creek,8/5/14,"started at footbridge at 0820, and worked down. stream low and clear. ended just before snagging pond because we ran out of trays, but there were at least 50 more dead chum within 40 feet of last processing area, mostly stuck in the backwater areas near the pond. Saw one stray chinook about 250m US of pond.",58.33035312,-134.5926755,,58.33049951,-134.5987732,,,,,357.6236138,450,Chum Salmon,272,296,,568,240,202,87.07,232,202,30,"Kelly Lawrence, Derrick Miller, jarrod yelton"
111-50-10690,Fish Creek,8/6/14,started just DS of road bridge and worked US. targeting dead fish only. several fish too rotten to measure heights.,58.33061018,-134.593318,,58.32914542,-134.5846481,,,,,533.5119818,450,Chum Salmon,140,395,,535,288,232,82.56,281,232,49,"Kelly Lawrence, Derrick Miller, jarrod yelton"
111-50-10690,Fish Creek,8/8/14,"started at road bridge at 0820 and worked DS. Sampled mostly dead fish, many rotten to the point that length and height measurements were no longer possible. ",58.33029638,-134.5921053,,58.33135458,-134.6003243,,,,,495.7366318,450,Chum Salmon,165,651,,816,352,271,78.78,344,271,73,"Kelly Lawrence, Derrick Miller, jarrod yelton"
111-50-10690,Fish Creek,8/9/14,"Rain!  Discharge increased and visibility decreased as day progressed.  Majority of live fish were observed actively spawning, and appeared fresh.  Majority of dead count were previously sampled fish.  Fish numbers diminished as we approached upper processing area/end location.",58.33073104,-134.594363,,58.32931373,-134.5812216,,,,,785.9434073,450,Chum Salmon,109,568,,677,178,139,79.89,174,139,35,"Alaire Hughey, Derrick Miller, dylan fournier"
111-50-10690,Fish Creek,8/12/14,"started at 0905 approximately 1/4mile ds of house with red roof, parallel to green channel marker closest to shore on stream left . low tide at 0910. water level high and water tannin brown, it has dropped slightly since two days ago but unsafe to wade in most sections, we sampled dead fish from banks. End point represents point where we could no longer walk on the banks due to thick alders and wading was not possible due to high flow. counted 158 headless (previously sampled) fish and 100 dead but intact fish. Intact fish not sampled were predated gonads. no live count because water was too deep/dark in95% of stream to get an accurate count but did see 68 in the reach between king pond and footbridge.  No scales taken due to decayed state of majority of sampled population.",58.33506874,-134.6053608,,58.33053477,-134.5955921,,,,,763.2426138,450,Chum Salmon,,258,,258,64,46,73.02,63,46,17,"Kelly Lawrence, Alaire Hughey, Derrick Miller"
111-50-10690,Fish Creek,8/14/14,"Same beginning and end points as two days ago, started DS at 1055 parallel to green channel marker and ended 500m DS of foot bridge. flow has actually risen slightly and visibility decreased since last visit, no live count taken. Counted 127 previously sampled fish and 72 sampled or unknown status chum. Sampled 4 live fish caught with gaff or hand in small side channel next to last processing area. ",58.33528906,-134.6057822,,58.33051938,-134.5956773,,,,,795.4075525,450,Chum Salmon,,199,,199,20,13,72.22,18,13,5,"Kelly Lawrence, Alaire Hughey, ben campen"
111-50-10690,Fish Creek,8/17/14,"started just US of king pond at 0800, in the time we were collecting and processing the river came up and turned dark brown, no longer safe to continue, stopped below large riffle 300m DS of footbridge.  End location was not captured on tablet; waypoint for last processing area was added as end location.  One male chinook salmon was observed in Fish Creek above the pond.  Many prespawn chum salmon were released following snagging capture.",58.33040599,-134.5983437,,58.33039229,-134.5960945,,,,,131.7841181,450,Chum Salmon,48,55,,103,51,43,93.48,45,43,3,"Kelly Lawrence, Alaire Hughey, Derrick Miller"
111-50-10690,Fish Creek,8/19/14,walked about 1/2 mile above normal end point to see if fish came up during high flow then worked DS. Saw 72 Kings between the usual end point and the king pond.  21 chums were observed above the highway bridge; the remainder were concentrated between the footbridge and pond.  Stage height had decreased since the previous visit and visibility improved.  All but the deepest pools were visible.  Majority of dead count was comprised of skeletal remains or specimens in late stages of decomposition. ,58.3266808,-134.5697876,,58.33491153,-134.6055011,,,,,2284.363017,450,Chum Salmon,95,135,,230,84,74,91.36,81,74,7,"Kelly Lawrence, Alaire Hughey, Derrick Miller"
111-50-10690,Fish Creek,8/21/14,"started US at 0925, just above normal end point about 20m US of small tributary on stream left. water level down from last visit. Low enough to see far more chum carcasses than last time, however,  the majority were too decomposed to sample (missing all muscle tissue or head). Between foot bridge and beginning, live chum count at 9 and dead at 100, with about 50% of dead counted in braided section alone. 124 chinook salmon observed.  Possible chumXpink salmon hybrid observed.",58.32843225,-134.5760301,,58.33386344,-134.602838,,,,,1683.046482,450,Chum Salmon,47,173,,220,61,54,91.53,59,54,5,"Kelly Lawrence, Alaire Hughey, Derrick Miller"
111-50-10690,Fish Creek,8/25/14,"fish sampled from king pond up to foot bridge.  above the foot bridge we popped in to the creek from the trail, but only one chum was observed. cloudy/rainy, with normal, clear water. ",58.33104296,-134.6000817,,58.33064228,-134.5944464,,,,,333.15284,450,Chum Salmon,2,68,,70,6,5,83.33,6,5,1,"Jarrod Yelton, Ashley Bolwerk, Ben Campen, Dylan Fournier"
111-50-10690,Fish Creek,8/28/14,started US at 0915 worked down. King salmon count: 51 dead and 7 alive. ended 100yards DS of red house.  The four live chums were observed between the footbridge and king salmon pond; two were snagged and released after confirming each were prespawn.  One snagged fish was mortally wounded and sampled.  ,58.32842228,-134.5761185,,58.33458926,-134.6048595,,,,,1818.522385,450,Chum Salmon,4,57,,61,4,3,75,4,3,1,"Kelly Lawrence, Alaire Hughey, Derrick Miller"
111-50-10690,Fish Creek,7/25/15,"SURVEY QUALITY: FAIR At the mouth at 9:30 am. Water clarity was poor, which factored in to our overall live/dead count quality. Survey ended at 4:30 pm. Worked from mouth to bridge then jumped on trail and went up to Valhalla and worked our way back to bridge (walking downstream). Majority of fish sampled were caught live, but post-spawned. Overcast but no rain, low water level. Many pinks and chum viewed in redds. ",58.33348276,-134.6020036,,58.32840723,-134.5761686,,,,,1615.708968,450,Chum Salmon,874,59,,933,160,100,65.36,153,100,53,"Alaire Hughey, Jarrod Yelton, Katie Shink, Brian LeBlanc, Roger Vallion"
111-50-10690,Fish Creek,8/2/15,"SURVEY QUALITY: FAIR Survey began at 9:30 am in tidal flats at low tide. Due to high numbers of dead and post-spawned chum we skipped sections of the stream and tried to limit our sampling efforts to historically productive areas. Sampled until the houses on the point, skipped straight-away section, started sampling from pond to the bridge. Then sampled from just above the road to the island and both channels on either side (sample locations are on the GPS). Fishing hole below strainer was a sample site. Final sampling effort was at valhalla. Hiked on the trail past valhalla approx. 1/4 mi. Didn't see any live or dead chum at our end survey location, only pinks. Visibility was good and water level was low. Lots of pinks and chums made our survey quality fair. Were relatively few chum at valhalla, mostly pinks. Survey ended at 4:00 pm. Saw a porcupine. Clear skys, sunny entire day.  ",58.33753464,-134.6083316,,58.3266536,-134.5697708,,,,,2563.635209,450,Chum Salmon,790,361,,1151,289,223,79.36,281,223,58,"Alaire Hughey, Jarrod Yelton, Katie Shink, Brian LeBlanc"
111-50-10690,Fish Creek,8/17/15,"SURVEY QUALITY: FAIR Survey began at 9:00 am on tidal flats. Weather was overcast, water levels were low and clear. Large number of live pink salmon throughout stream. Large number of dead, spawned-out chum in tidal flats; number observed grew fewer further upstream. No dead or live chum salmon observed in 'valhalla'. Only a few dead specimens collected above the bridge. Large numbers of dead chum salmon resulted in a fair survey quality. Recorded GPS location of first observed redd in tidal flats (no fish were present), which was labled as 'redd intertidal'. Survey ended at 2:00 pm. ",58.33730345,-134.6081429,,58.32864095,-134.5760296,,,,,2114.290884,450,Chum Salmon,104,651,,755,180,163,93.68,174,163,11,"Alaire Hughey, Jarrod Yelton, Katie Shink, Brian LeBlanc"
111-50-10690,Fish Creek,7/20/17,"SURVEY QUALITY: EXCELLENT started at top at 12:17pm. lots of  pooling prespawn chum and pinks. Water quality clear and water levels fairly low, which made spotting live and dead chum easy.  Overcast skies throughout the day. Saw a baby porcupine. ",58.32834893,-134.5760934,,58.33699284,-134.6083771,,,,,2122.249929,450,Chum Salmon,404,6,,410,6,2,33.33,6,2,4,"Meredith  Condon, Misha Klassen, Brian  Leblanc, Cory Dick, Chance Gray"
